{
  "schemaVersion": 1,
  "profile": "device-link-v1-host-transaction-transcript",
  "class": "golden",
  "hostSimulation": true,
  "fixture": {
    "activeSnapshotId": "sha256:1111111111111111111111111111111111111111111111111111111111111111",
    "lastGoodSnapshotId": "sha256:1111111111111111111111111111111111111111111111111111111111111111",
    "generation": "7"
  },
  "scenarios": [
    {
      "id": "DLTX-GOLDEN-TWO-FILE",
      "title": "Successful two-file transfer with multiple ordered chunks",
      "steps": [
        {
          "id": "STEP-BEGIN",
          "request": {
            "schemaVersion": 1,
            "profile": "loopback-json-v1",
            "kind": "request",
            "requestId": "REQ-G1-BEGIN",
            "op": "snapshot.stage.begin",
            "payload": {
              "transactionId": "TX-G1",
              "snapshotId": "sha256:2222222222222222222222222222222222222222222222222222222222222222",
              "totalBytes": "10",
              "fileCount": 2,
              "expectedActiveSnapshotId": "sha256:1111111111111111111111111111111111111111111111111111111111111111",
              "manifestByteLength": "6"
            }
          },
          "expected": {
            "ok": true,
            "semanticMutation": "changed"
          }
        },
        {
          "id": "STEP-AUDIO-0",
          "request": {
            "schemaVersion": 1,
            "profile": "loopback-json-v1",
            "kind": "request",
            "requestId": "REQ-G1-WRITE-1",
            "op": "snapshot.stage.write",
            "payload": {
              "transactionId": "TX-G1",
              "path": "manifest.json",
              "offset": "0",
              "byteLength": 3,
              "dataBase64": "YWJj",
              "chunkSha256": "ba7816bf8f01cfea414140de5dae2223b00361a396177a9cb410ff61f20015ad"
            }
          },
          "expected": {
            "ok": true,
            "semanticMutation": "changed"
          }
        },
        {
          "id": "STEP-AUDIO-3",
          "request": {
            "schemaVersion": 1,
            "profile": "loopback-json-v1",
            "kind": "request",
            "requestId": "REQ-G1-WRITE-2",
            "op": "snapshot.stage.write",
            "payload": {
              "transactionId": "TX-G1",
              "path": "manifest.json",
              "offset": "3",
              "byteLength": 3,
              "dataBase64": "ZGVm",
              "chunkSha256": "cb8379ac2098aa165029e3938a51da0bcecfc008fd6795f401178647f96c5b34"
            }
          },
          "expected": {
            "ok": true,
            "semanticMutation": "changed"
          }
        },
        {
          "id": "STEP-INDEX-0",
          "request": {
            "schemaVersion": 1,
            "profile": "loopback-json-v1",
            "kind": "request",
            "requestId": "REQ-G1-WRITE-3",
            "op": "snapshot.stage.write",
            "payload": {
              "transactionId": "TX-G1",
              "path": "audio/a.bin",
              "offset": "0",
              "byteLength": 2,
              "dataBase64": "V1g=",
              "chunkSha256": "43b7c239d8bfd2f3c62d5bac183d1a1d1c1e665c5c4caf301e51e9f674ca186a"
            }
          },
          "expected": {
            "ok": true,
            "semanticMutation": "changed"
          }
        },
        {
          "id": "STEP-INDEX-2",
          "request": {
            "schemaVersion": 1,
            "profile": "loopback-json-v1",
            "kind": "request",
            "requestId": "REQ-G1-WRITE-4",
            "op": "snapshot.stage.write",
            "payload": {
              "transactionId": "TX-G1",
              "path": "audio/a.bin",
              "offset": "2",
              "byteLength": 2,
              "dataBase64": "WVo=",
              "chunkSha256": "b7198772da96fcef4ced89a98012153597aa661d40e8cb2d38982f57af7b299b"
            }
          },
          "expected": {
            "ok": true,
            "semanticMutation": "changed"
          }
        },
        {
          "id": "STEP-VERIFY",
          "request": {
            "schemaVersion": 1,
            "profile": "loopback-json-v1",
            "kind": "request",
            "requestId": "REQ-G1-VERIFY",
            "op": "snapshot.verify",
            "payload": {
              "transactionId": "TX-G1"
            }
          },
          "expected": {
            "ok": true,
            "semanticMutation": "changed"
          }
        },
        {
          "id": "STEP-ACTIVATE",
          "request": {
            "schemaVersion": 1,
            "profile": "loopback-json-v1",
            "kind": "request",
            "requestId": "REQ-G1-ACTIVATE",
            "op": "snapshot.activate",
            "payload": {
              "transactionId": "TX-G1",
              "expectedActiveSnapshotId": "sha256:1111111111111111111111111111111111111111111111111111111111111111"
            }
          },
          "expected": {
            "ok": true,
            "semanticMutation": "changed"
          }
        }
      ],
      "expectedFinal": {
        "activeSnapshotId": "sha256:2222222222222222222222222222222222222222222222222222222222222222",
        "lastGoodSnapshotId": "sha256:1111111111111111111111111111111111111111111111111111111111111111",
        "generation": "8",
        "transactions": {
          "TX-G1": {
            "status": "Activated",
            "committedBytes": "10",
            "committedFiles": 2
          }
        }
      },
      "covers": [
        "two-file-multi-chunk",
        "begin-cas",
        "activate-cas"
      ]
    },
    {
      "id": "DLTX-GOLDEN-REQUEST-REPLAY",
      "title": "Identical request ID replay returns the durable cached response",
      "steps": [
        {
          "id": "STEP-FIRST",
          "request": {
            "schemaVersion": 1,
            "profile": "loopback-json-v1",
            "kind": "request",
            "requestId": "REQ-G2-BEGIN",
            "op": "snapshot.stage.begin",
            "payload": {
              "transactionId": "TX-G2",
              "snapshotId": "sha256:2222222222222222222222222222222222222222222222222222222222222222",
              "totalBytes": "3",
              "fileCount": 1,
              "expectedActiveSnapshotId": "sha256:1111111111111111111111111111111111111111111111111111111111111111",
              "manifestByteLength": "3"
            }
          },
          "expected": {
            "ok": true,
            "semanticMutation": "changed"
          }
        },
        {
          "id": "STEP-REPLAY",
          "request": {
            "schemaVersion": 1,
            "profile": "loopback-json-v1",
            "kind": "request",
            "requestId": "REQ-G2-BEGIN",
            "op": "snapshot.stage.begin",
            "payload": {
              "transactionId": "TX-G2",
              "snapshotId": "sha256:2222222222222222222222222222222222222222222222222222222222222222",
              "totalBytes": "3",
              "fileCount": 1,
              "expectedActiveSnapshotId": "sha256:1111111111111111111111111111111111111111111111111111111111111111",
              "manifestByteLength": "3"
            }
          },
          "expected": {
            "ok": true,
            "semanticMutation": "unchanged",
            "replayed": true
          }
        }
      ],
      "expectedFinal": {
        "activeSnapshotId": "sha256:1111111111111111111111111111111111111111111111111111111111111111",
        "lastGoodSnapshotId": "sha256:1111111111111111111111111111111111111111111111111111111111111111",
        "generation": "7",
        "transactions": {
          "TX-G2": {
            "status": "Staging",
            "committedBytes": "0",
            "committedFiles": 0
          }
        }
      },
      "covers": [
        "request-id-replay"
      ]
    },
    {
      "id": "DLTX-GOLDEN-CHUNK-IDEMPOTENT",
      "title": "Same durable chunk under a new request ID is idempotent",
      "steps": [
        {
          "id": "STEP-BEGIN",
          "request": {
            "schemaVersion": 1,
            "profile": "loopback-json-v1",
            "kind": "request",
            "requestId": "REQ-G3-BEGIN",
            "op": "snapshot.stage.begin",
            "payload": {
              "transactionId": "TX-G3",
              "snapshotId": "sha256:2222222222222222222222222222222222222222222222222222222222222222",
              "totalBytes": "3",
              "fileCount": 1,
              "expectedActiveSnapshotId": "sha256:1111111111111111111111111111111111111111111111111111111111111111",
              "manifestByteLength": "3"
            }
          },
          "expected": {
            "ok": true,
            "semanticMutation": "changed"
          }
        },
        {
          "id": "STEP-WRITE",
          "request": {
            "schemaVersion": 1,
            "profile": "loopback-json-v1",
            "kind": "request",
            "requestId": "REQ-G3-WRITE-1",
            "op": "snapshot.stage.write",
            "payload": {
              "transactionId": "TX-G3",
              "path": "manifest.json",
              "offset": "0",
              "byteLength": 3,
              "dataBase64": "YWJj",
              "chunkSha256": "ba7816bf8f01cfea414140de5dae2223b00361a396177a9cb410ff61f20015ad"
            }
          },
          "expected": {
            "ok": true,
            "semanticMutation": "changed"
          }
        },
        {
          "id": "STEP-WRITE-NEW-ID",
          "request": {
            "schemaVersion": 1,
            "profile": "loopback-json-v1",
            "kind": "request",
            "requestId": "REQ-G3-WRITE-2",
            "op": "snapshot.stage.write",
            "payload": {
              "transactionId": "TX-G3",
              "path": "manifest.json",
              "offset": "0",
              "byteLength": 3,
              "dataBase64": "YWJj",